INITIALIZATION
CREATE TABLE UPDATE_TABLE_1(ID INT, T_NAME CHAR, COL1 INT, COL2 FLOAT, COL3 DATE);
SUCCESS
CREATE INDEX INDEX_ID ON UPDATE_TABLE_1(ID);
SUCCESS
INSERT INTO UPDATE_TABLE_1 VALUES (1,'N1',1,1.0,'2032-04-02');
SUCCESS
INSERT INTO UPDATE_TABLE_1 VALUES (2,'N2',1,1.0,'1983-03-02');
SUCCESS
INSERT INTO UPDATE_TABLE_1 VALUES (3,'N3',2,1.0,'2005-02-27');
SUCCESS

1. UPDATE A ROW
UPDATE UPDATE_TABLE_1 SET T_NAME='N01' WHERE ID=1;
SUCCESS
SELECT * FROM UPDATE_TABLE_1;
1 | N01 | 1 | 1 | 2032-04-02
2 | N2 | 1 | 1 | 1983-03-02
3 | N3 | 2 | 1 | 2005-02-27
ID | T_NAME | COL1 | COL2 | COL3

2. UPDATE ROWS
UPDATE UPDATE_TABLE_1 SET COL2=0.0 WHERE COL1=1;
SUCCESS
SELECT * FROM UPDATE_TABLE_1;
1 | N01 | 1 | 0 | 2032-04-02
2 | N2 | 1 | 0 | 1983-03-02
3 | N3 | 2 | 1 | 2005-02-27
ID | T_NAME | COL1 | COL2 | COL3

3. UPDATE A INDEX COLUMN
UPDATE UPDATE_TABLE_1 SET ID=4 WHERE T_NAME='N3';
SUCCESS
SELECT * FROM UPDATE_TABLE_1;
1 | N01 | 1 | 0 | 2032-04-02
2 | N2 | 1 | 0 | 1983-03-02
4 | N3 | 2 | 1 | 2005-02-27
ID | T_NAME | COL1 | COL2 | COL3

4. UPDATE WITHOUT CONDITIONS
UPDATE UPDATE_TABLE_1 SET COL1=0;
SUCCESS
SELECT * FROM UPDATE_TABLE_1;
1 | N01 | 0 | 0 | 2032-04-02
2 | N2 | 0 | 0 | 1983-03-02
4 | N3 | 0 | 1 | 2005-02-27
ID | T_NAME | COL1 | COL2 | COL3

5. UPDATE WITH CONDITIONS
UPDATE UPDATE_TABLE_1 SET COL3='1997-05-12' WHERE COL1=0 AND COL2=0.0;
SUCCESS
SELECT * FROM UPDATE_TABLE_1;
1 | N01 | 0 | 0 | 1997-05-12
2 | N2 | 0 | 0 | 1997-05-12
4 | N3 | 0 | 1 | 2005-02-27
ID | T_NAME | COL1 | COL2 | COL3

6. UPDATE MULTIPLE COLUMNS
UPDATE UPDATE_TABLE_1 SET T_NAME='N02', COL1=83, COL2=56.29, COL3='2030-11-14' WHERE ID=1;
SUCCESS
SELECT * FROM UPDATE_TABLE_1;
1 | N02 | 83 | 56.29 | 2030-11-14
2 | N2 | 0 | 0 | 1997-05-12
4 | N3 | 0 | 1 | 2005-02-27
ID | T_NAME | COL1 | COL2 | COL3

7. UPDATE NON-EXISTENT TABLE
UPDATE UPDATE_TABLE_2 SET T_NAME='N01' WHERE ID=1;
FAILURE

8. UPDATE NON-EXISTENT COLUMN
UPDATE UPDATE_TABLE_1 SET T_NAME_FALSE='N01' WHERE ID=1;
FAILURE

9. UPDATE WITH INVALID CONDITION
UPDATE UPDATE_TABLE_1 SET T_NAME='N01' WHERE ID_FALSE=1;
FAILURE

10. UPDATE IN VAIN
UPDATE UPDATE_TABLE_1 SET T_NAME='N01' WHERE ID=100;
SUCCESS
SELECT * FROM UPDATE_TABLE_1;
1 | N02 | 83 | 56.29 | 2030-11-14
2 | N2 | 0 | 0 | 1997-05-12
4 | N3 | 0 | 1 | 2005-02-27
ID | T_NAME | COL1 | COL2 | COL3

11. UPDATE WITH INVALID VALUE
UPDATE UPDATE_TABLE_1 SET COL1='N01' WHERE ID=1;
FAILURE
